text,label
greta es un estupendo medidor para comprobar cuando una cumbre internacional es una puta mierda  lo de davos es una reput  sima mierda,0
lamismamente  sylvyako  polibueno     aeperio  albert dmcat una andaluza orgullosa de ser espa ola  eres como si una negra fuera del kkklan,1
pablo casado  tomando las huellas dactilres de los negratas  por si se escapan  la c mara est  entre los dedos  ndice y coraz n,1
casi los m os son negros,0
conectandocaminosporlosderechos        la cl  nica jur  dica para migrantes se une a la feria de servicios que organiza la  cancilleriacol junto a  oimcolombia para personas colombianas retornadas  migrantes y refugiadas     t co uhxwwabbz,0
la soluci n es soldarle el tim n de la patera rumbo de donde salieron con agua y comida,1
lilveronicar  marica      my sue  o hecho realidad       url,1
vendo dos entradas puro latino zona oro  entradas fisicas a,0
francis         el coletas es muy corto  tiene en su mano embargar hasta los calzones a inda pero es demasiado monguer,1
las feminazis sois bastante hip  critas criticando a  pedrochecampanadas cuando ten  is por bandera a las femmen siempre con el pecho al aire  ah   lo dejo,1
callate hijo de puta  fuiste una mierda y vas a terminar tu vida siendo una mierda,0
lenin usted tiene una feminazi de ministra  mariapaularomo,1
jarethmori  hectorbecerrilr feminazi tiene un concepto  hijes  hijxs     no  abrazo,1
guste o no en unas elecciones hist ricas  ha ganado el bloque independentista  punto  pero los no independentistas est n muy vivos en catalu a y son mayoritarios una cosa son esca os y otra votos   est  claro que catalunya esta dividida  toca hablar  dejar la guerra       d    t co fnuw v sfk,0
vxerocomunista  miaumiaumiaushh  kamikaz          pacohavuelto    populacho  vlc ji  carmatpor  morafanova  m a d r i  calimeroinfante  il lustre  christi          freeyellowmarta  pilicar   juan acosta gar  mrjesusfigueroa  javilin    marcklein   mj,0
bolsonaro critic amp oacute  a la activista greta thunberg y la calific amp oacute  de  mocosa  http   t co  http   t co,0
me cuesta un buen lidiar con las muertes trans  desde que sal   del cl  set hace   a  os he despedido a m  s de   amigas,0
es que yo s   que no me siguen porque no soy lesbiana  feminazi  atea o exhibicionista,0
estamos de acuerdo que patrick miller siempre fue h  tero  pero que hubo un tiempo que era muy gay   me urge que regrese esa ola homosexual,0
mcfachafly  asolucel  stevek wonders ilustrado por ch  vez y la izquierda latinoamericana  no olvide que zapatero es pimpollo del chavismo  con mina de oro en venezuela incluida  estos izquierdosos les encanta vivir como capitalistas mientras hablan de s,0
mcpollo est   jota jota tu nueva foto de perfil   megusta,0
la catalu a independentista siempre  solidaria   otorga m s votos a puigdemont que se encuentra de vacaciones en bruselas  que a junqueras de vacaciones en la prisi n de estremera,0
acertado y recomendable  cuando un independentista se envuelve en bandera  mira cu nto  c mo y qui n llena su cartera,0
vengo enn modo arabe para que las pussy la bailen del reves quiero las botellas al aire    papi champ saca un tem n para romper tarima y d rsela en la pera   d as antes de venir a camelot  coincidencia  no lo creo queremos free  obvio,0
los asistentes al desfile del orgullo gay en nueva york critican a trump,0
el problema es como vas a hacer para que una feminazi  que se desnuda en una plaza p  blica recordandonos a chewbacca  lo entienda  http   t co,1
alg  n alguna algune especialista en  drag por aqu   que quiera compartir conocimiento y salir en la tv  url,0
sigridbazan chau gays  lesbianas  aborteras  feminazis  frepap y upp erradicar  n esos grupos rainbow,1
subversivos   crrjrrb selecci n  como la raza aria   asco de fascistas,1
juanmi    suave el drip veneko,0
un rt para semen  movimiento machista internacional,0
empresa venezolana de miner  a obtiene certificado oficial de whatsminer para mantenimientos    t co uss  gq  r    t co qf  jnkb p,0
robertodoriajo  josem       rosafregi  guajesalvaje  orapma  de momento teneis un estado fascista de vuestro lado y os podeis permitir difundir odio impunemente  os sentis fuertes y valientes  pero nuestra raz n y la justicia acabaran ganando  y no  no estoy amargada,0
ainhoagbilbao x cierto  x comentarios c  mo   ste se confunde feminismo con feminazi,0
amigo no ser  usted un poco tonto y o subnormal     t co ex f y l l,1
exoscopia s   puedo admitir que haya habido una posible influencia del t  rmino  imra  por parecido  pero m  s probable me parece que en el castellano antiguo no hubiera un t  rmino com  n para decir mujer  porque de hecho en las lenguas latinas hay vari,0
diego schalper o sea que ese acuerdo era el techo y efectivamente se cagaron a la ciudadan  a  prep  rate wn  la ola feminista se volver   tusunami,0
la cup  es decir  los estalinistas amigos de eta  piden m s mano dura  esta mierda de gobierno catal n  golpista y fascista poniendo el culo    t co ygitbfyyzo,1
todo asexual tiene un algosexual que le da asco url,0
perdiguerosipep a ti tambi  n te han pillado en uno gordo  audios caso arandina   para ser polic  a eres un poco tonto,0
comportamiento ejemplar   no paga billete se cuela  le pillan y se pone chulo y amenaza  que buena es la inmigraci n sin control  nos entran personas agradables  amables que solo buscan estar encima tuya   pero no pasa nada,1
bolsonaro llama  mocosa  a  gretathunberg por denunciar la muerte de ind  genas en la lucha contra la deforestaci  n de la amazonia  http   t co,0
aiammohamedd lo que yo no s   es qu   quiere decir con eso jandra y los    borregos q le dan me gusta  cual es la soluci  n  exterminar a la  poblaci  n musulmana,1
noe       diariolaopinion racista  hueles a la legua  nadie quiere inmigraci  n ilegal  pero si est  n en el mar con una patera que  los dejamos morir  menudo ser  porque de humano tienes muy poco  y si  pagar  n tu pensi  n  la inmigraci  n supone benef,0
sentencia arandina  un resumen  http   t co,0
callate forro alcahuete y arrastrado de la kretina hija de mil puta que aun hoy te sigue dirigiendo titere   no te olvides que no llegas ni a cebollita   perdiste las elecciones en tu propia intendencia pecho fri,0
si por rechazar  ense ar el culo  ense ar las tetas  follar  liarme con quien me salga dl co o o etc soy una guarra  tranquil   ser  a n m s guarra todav a  pero lo que realmente soy  es libre  libre de hacer con mi cuerpo y con mi vida lo que yo quiera  no lo que a ti te guste,0
ya el dictador cuenta con las arma de los marin de vnzla,0
marianorajoy  y lo dices t  con esa cara de facha,0
cindy aparicio dec  a una mujer atleta     cuando te va bien   te van a culpar de ser hombre     a caster semenya   que no es trans la obligaron a tomar medicina por que era    muy buena naturalmente    url  a leonel messi le celebran que tom   hormonas,0
ol porque me gusta y por patriotismo  a ver si os enter is pedazo de fachas,1
descriterio  sigan apoyando a las feminazis y progresistas           la putrefacta y f  tida izquierda latinoamericana    con estas im  genes es que mojan sus pantys  petrogustavo y  gustavobolivar     amp  toda su orda de orcos  zombies  drogos  piojoso,1
quiero que el pibe me diga   tu eres mi puta la mejor que mama   jaaja ahre,1
independentista rajoy via,0
la afici n de osasuna est  muy por encima de resultados y divisiones y la temporada que viene va a disfrutar la hostia  y se la pela donde,0
hoy en  chopy se pone fino     un franc s  tortilla francesa   guarrilla   t mate  asi se termina bien la semana        t co heiz snlgn,0
traficantes de personas lanzan a un ni  o migrante  de    a  os  desde lo alto del muro fronterizo en san diego   california  en la frontera entre ee uu y m  xico  cae herido  tambi  n pasan a otro ni  o migrante  de tres a  os         t co gfxzimyxwy,0
jajajajajajjajajajajajajjaa ay dios la mujer es maldad me voy de aqui  que puta pavera,1
dejo este tuit ac   pa   l pr  ximo genio o genia transf  bica que argumente las mujeres trans somos la amenaza de la sociedad y de  inserte situaci  n  debido a nuestros huesotes,0
vale  pero la mayor a de personas que sufren violencia sexual y o maltratos por su g nero s n las mujeres,0
hoy  en el curro  le he montado un pollo interesante a un ni ato al que le estoy ense ando    soy un hijo de puta a veces  sip,0
millones de votos al bloque independentista  pero luego los   millones de votos del son falsos  eh,0
hola   mamporrero   mayor a independentista   ola k ase   est s llorando o k ase,0
lordbazingga   lol tiene un avatar de sheldon   puto perro catal n enfin,1
no todos maltratamos  no todos somos machistas  no todos    no generalizar porfa  que nosotros tambi n nos avergonzamos de nuestro genero,0
japonton a  juanmapregunta  internautas que han cometido infidelidad en redes sociales  la mayor  a son homosexuales,0
castillomedueles desde ya se nota que tu mensaje es aire    tres d  as y se van los venecos    aire,0
lafallaras tu estas loca   vieja y fea vete a la p      mierda,1
el d a que debas ir con miedo por la calle si vas con tu pareja por ser hetero  hablaremos de heterofobia  mientras  callate la puta boca     t co yjmhdsdhhd,0
me extra a mucho que los medios de comunicaci n no se hagan eco del asesinato de una persona y s  de programas escoria y tonterias,0
mergarza de seguro las mismas personas que les dijeron    aseg  rense de decirle a todas las mujeres trans la palabra hombre  si se puede  h  ganlo varias veces al d  a      ese pendiente tambi  n lo traen me cae,0
sectarismo  infantilismo  misticismo    este tipo de gente acabar n siendo pasto de la ultraderecha,0
video  lobby gay ataca con pintura  huevos y piedras al en m xico,0
laetxebarria venga a fregar,1
y mientras a ti te piden que vivas como un refugiado    t co n fmvrf  u,0
vox denuncia a una asociaci  n feminista de castell  n por unas pintadas de abascal    con un tiro en la frente    http   t co  http   t co,0
en la primera partida me he comido una polla por imbecil vamos a la segunda,0
el r gimen fascista de kiev bombardea a los civiles en donbass v a,0
no te confundas  en esos    a os se ha transformado de nacionalista en independentista     t co  hv lu pfx,0
en este pa s a shakira de puedes decir lo que quieras eso s  como digas algo malo de carrero blanco se te cae el pelo  pa s de fachas,0
squalicorax son distintas tonalidades de negro,0
tumbafalsa   yo tambi  n    ya lo sigues en ig  yo no lo conoc  a nada y el fin me avent   todos sus episodios de gay of thrones,0
una embarazada y cinco menores entre los    inmigrantes de dos pateras argelinas      las dos embarcaciones fueron detectadas por salvamento mar  timo en torrevieja y alicante  con dos mujeres y cinco menores  entre ellos una ni  a de seis meses    t co n xtie qho,0
as  son vulgares no tienen m s argumentos aprendieron el legado aquel  te pego en la cara marica  del innombrable,0
la inmigraci n legal s lo satisface el     de las necesidades de la agricultura,0
monasterior  inestorquemada por qu   no se plantea el tema lgtb en toda la saga   y una lesbiana mi un gay haciendo de  loca  decoradora    por no haber no hay ni un polvo decente  menuda puta mierda de saga  juego de tronos le da mil vueltas a estas pel,0
en el hormiguero est n ense ando los filtros de snapchat como si fueran una novedad  qu  puta pena,0
ha llegado el excmo  panchito,1
elche gibra  podemos  serigne mbaye  la foto de la derecha no es de marruecos si no de rafah ciudad de palestina,0
marianavilab tocador es un poco machista y mis  gino  no,0
por que las mujeres se casan de blanco  para hacer juego con el refrigerador  la cocina y la lavadora,1
combate musical a muerte  con calz n rojo  el rock roll ac stico de los frijoles  con calz n morado  el humor combativo de latxusma este s bado de       a       horas en el musaeum  c  san bernardo     xix n  organiza  espaciu pal cambiu  hacemossn colaboraci n        t co xayda vo w,0
quimixto  para  so ah   estaba lleno de extranjeros muy guap  simos   y todos eran gays   era algo as   como el para  so homosexual                                                      en quimixto url,0
el barsa explot  la idea antifranquista siendo el club franquista por excelencia unico club en dar la medalla de oro al dictador,0
ecuatorianos  estamos pagando los caprichos de ord    ez  quien no sabe un pepino sobre seguridad p  blica  en los hospitales falta hasta el hilo de sutura  cada vez hay m  s migraci  n  m  s sicariatos  m  s robos y menos trabajo    hasta cuando aguantamos     t co kiwe umtnv,1
oigan yo ya tenia bien normalizado que los amigos vatos me dijeran feminazi y me criticaran por eso a mis espaldas  conocer a carlitos es de lo mas bonito que me ha pasado,0
en mi casa no me quieren por lesbiana  supieran que es mi sue  o frustrado alv,0
condenados a    a  os los tres exjugadores de la arandina  el tribunal considera que cada uno es autor de una violaci  n y cooperador necesario en las otras dos http   t co   deportes  kirolak http   t co,0
vanesavallejo  as   o m  s claro as   se le habla a los vientres secos resentidas sociales que quieren llamar la atenci  n ncion con sus estupidas http   t co  imbecilidad factor que domina el mundo de las feminazis,1
est  claro  monse or diego padr n  constituyente impondr  una dictadura militar  socialista y comunista,0
borrando de mi vida a casi todo mi colegio  es un ciclo  publican algo  pro vida  que en realidad es en contra del aborto  comento su publicaci  n  pq toy de vacaciones  les pido que me expliquen su argumento  me dicen feminazi  los elimino  fin,0
una persona como bolsonaro      de qu   forma contrinuir  a a promocionar a un l  der prefabricado  porque si lo apoya abiertamente es como denigrarlo  http   t co,0
fue noche de vestidas  streppers  gogo s  besos lesbico y besos de jotos url bienvenido a tampico,0
la doctrina tras el caso de  la manada  que se aplica al caso arandina  intimidaci  n ambiental y condena por cooperaci  n en cada delito de agresi  n http   t co  http   t co,0
a fregar los platos muy fumada escuchando hannah montana best of both worlds,0
aunque sea aqu        mujeres muertas en espa a por violencia de g nero  paro  pobreza  pero importa m s qu  puto equipo gane,0
un entrevistado por  pontifex es por abuso sexual  ahora homosexual   imprudentemente o maliciosamente afirm   que el papa le hab  a dicho que  dios lo habia hecho as   y as   lo amaba   info sin fundamento  cnnee como otras declaraciones pubicadas incendiariamente  un mensaje de fe url,0
c llate loca todo el a o fue al rev s puta,1
daniel          juleno     fabiomelo    agfon   esperamos    anos para ser bi campe  o da libertadores,0
greta dijo que los ind  genas murieron porque estaban defendiendo el amazonas    c  mo pueden los medios dar espacio a una mocosa como esa      dijo el presidente bolsonaro  http   t co,0
conejo      ernesto          osoriosantiago migrante es migrante toda la vida   la izquierda nunca a gobernado   vos te fuiste a buscar mejores oportunidades  las que t   amado gobiernos de extrema derecha  que siempre ha estado el poder nunca te dio  aq,0
enquanto participava de uma partida de futebol society  o goleiro dias sentiu dores no peito e foi conduzido a uma unidade m  dica da cidade  o hospital s  o vicente de paula  http   t co,0
el diputado franco casella pidi   a la asamblea nacional venezolana que se pronuncie sobre las irregularidades que est  n ocurriendo con los documentos de los venezolanos en diversos pa  ses a los que ha llegado la migraci  n              por   thabatica     t co p ebcw gsr,0
tu clase trabajadora ha votado masivamente a la ultraderecha espa olista con una bandera rojigualda as  de gorda  y no os ha votado a vosotros  paladines de la lucha obrera  me explicas por qu   por qu  les dej is en manos del fascismo  in tiles,0
caitlyn jenner   ngela ponce elliot page  no saben como agradezco que sean personas abiertamente trans    nom  s con mencionarles en chinga gente que pensabas eran decentes s  per sale a relucir que son idiotas de primera,0
amenaza con que ahora van a salrr los audios  salen y ahora dice que hablan por si solos  est   claro quien los ha filtrado no  ojal   le metan otros cuantos a  os m  s  http   t co,0
cogiendo el testigo de su colega el mongolo roncero  vaya paga que tienes carajaula    t co  spircvsnk,1
campaniniclau mientras mar  a se ocupa de estas cosas un poco extra  as para una feminista  la presidenta ni debe tener tiempo para leerla  tiene que pacificar el pa  s  ocuparse de que todo salga bien con las elecciones  vi que ahora somos parte del gru,0
eran marroqu  es y argelinos  estamos en una situaci  n de alerta nacional  no hac  is ning  n favor ocultando a la gente la nacionalidad de estas bestias  elmundoes    t co zmhr  zusj,1
sois mazo pesados con el humor negro en twitter macho xd,0
los guardias civiles que sean agredidos la primera obligaci n que tienen es la de disparar  por dignidad  pasando de los pol ticos mierdas      inmigrantes saltan la valla fronteriza de ceuta y hieren a cinco guardias civiles,1
ir en el bus y que un gilipollas suelte  cito textualmente   una cosa es ser homosexual y otra cosa es ser mariquita   me explic is,0
esta es la loca de la sudadera verde que le dio alegr  a a la canci  n feminazi en slp http   t co,1
no somos racistas pero algunas latinas miran con una cara    que parecen brujas   joder,1
inesarrimadas no sera que  como decimos muchos  espa  a esta hecha desde la imposici  n y la fuerza castellanas y contra la gente que habita los territorios y sin respetar nada  y por eso espa  a s  lo se sostiene con represi  n y violencia  apr  ndelo d,0
que plaga los  cu aos   pillan al cu ado de arrimadas llam ndola  facha  en twitter     t co  bgewko  g,0
cnnee a la greta le gustan las armas de alto poder   tal vez no es tan loca como parece http   t co,0
rial es otro hijo de puta    pobre chica no merec a q este psic pata jugara con su mente,0
momento del d a  vero y yo cogidos de la mano mientras me dice   es que t  eres muy zorra,1
si abro el video de greta va a dejar de aparecerme en el tl hijos de puta,0
entr   a abofetear a uno de los detenidos  al     d  a de salvajes torturas los detenidos se confesaron culpables   d  as despu  s un tribunal militar franquista les proces   en consejo de guerra  aunque negaron su culpabilidad les condenaron a muerte,0
tengo una sobrina que estaba re mal en qu mica  ten a que dar una prueba global y fui a ense arle y le fue la zorra  me siento tan bien,1
criszis de hecho conozco a una amiga que justo procter  amp  gamble no la contrato cuando avis   era trans   buenaspracticaslgbt,0
yaz paty desde lo trans   siempre invito a las mujeres feministas a considerar que yo decid   a conciencia el transicionar y vivir todo lo femenino,0
los tiras  pdi  q encontraron    venezolanos en rengo sin papeles e irregulares tbn de habr  n pegado en la cabeza hay miles de venecos irregulares,1
c  mo solicitar una cita adicional para tramitar su pasaporte en la sede central de migraciones     t co pm xfd zwf,0
inspector de la polic a es detenido por violaci n y acoso sexual,0
eldiarioes alguna propuesta legislativa  pero para aplicar a todo el mundo por igual  blanquitos vascas catalanas  jugadores del arandina  extrajeros residentes y urdangarines  ricos  hijos de jueces  politicos pura casta  la justicia deja mucho que dese,0
banda de indocumentados     siempre ha sido igual        t co zlfblddedd,1
heartofsteel    ah maric n jajajajajajaj seis y media,0
esto de ser rojo es una mierda porque no registras las marcas y  claro  luego las usan sin tu consentimiento,0
rdavidmanzano capaz si ese grupo de feminazis se enteran que se masturbo pensando en una de ellas lo cuelgan delante de todas en una plaza y celebran con cervezas,1
siento que tengo ansiedad pero a la vez no y me estoy volviendo puto loca,0
volviendo al tema arandina chavales  sabed que ya nunca podr  is desvirgaros  como anta  o  con chicas hasta que teng  is          a  os  que es la edad en que una de    os considerar    maduros  y  a su nivel intelectual      a  azos  mejor pel  rsela   arandina,1
monicacarrillo do  a m  nica  en el     de   frica no se puede abortar  pero usted calla y no dice nada     no ser   lo suyo postureo y adem  s del malo,1
se cre  a que los alemanes son igual de gilipollas que algunos espa  oles      millones tirados a la basura  nunca mejor dicho  greta thunberg se lleva un zasca de los ferrocarriles alemanes    gracias por viajar en primera clase   http   t co,0
por qu   si el gobierno es dem crata y no fascista  deber a permitirlo  los ciudadanos tienen derecho a saber  parece que alguien tiene,0
jajaja uy que gracia madre m a vamos a centrar el odio en la lesbiana poc    t co a  zsr ugl,0
el portavoz de  facua   rubensancheztw  ha anunciado que se pondr  n este viernes a disposici  n judicial los certificados de la difusi  n de los audios de la v  ctima del  caso arandina  http   t co,0
rt  superposh       ophcourse los transfobicos es la fobia a los transformers   lt  exacto  decepticons,0
dalasreview  eldiariodedross dalas    sinceramente que esperas de un cobarde como el  mejor hay que vivir la vida loca,0
ma  ana habr   un caso que alguien le diga preciosa a una tipa  literalmente bella y preciosa  ella se sienta alagada pero le pasa desapercibido al mismo tiempo  y una feminazi la vea y la insulte por  dejarse acosar,1
lastra toma posiciones en el psoe y aguarda la ca  da de s  nchez  de que iba a vivir esta indocumentada       t co l u qvbfgq,0
inesarrimadas el putu amo  no com tu que cardes puta pena,0
nuevo c  mic  gay days  activo   un mundo lleno de satisfacciones les espera a quienes cruzan la zona   pasivo  xd  url,0
lamban haber si tienes verg enza y demuestras ser socialista y recibes al compa ero pedro  pero como eres cobarde como golpista no lo haras,1
amaneradatrans quiero escribirles un libro a toda la comunidad trans  algo bonito y positivo  pronto les informo  necesitar   que me ayuden con algunas confesiones  y buscamos un t  tulo hermoso      y venderemos muchos ejemplares reina m  a  abrazos,0
general raul isaias baduel convoca al desafio politico desde la carcel abril        t co hgtfhryirp    autodefensacivilmilitar,0
qu  quer s con estos negros franchutes,1
alrededor de     inmigrantes saltan la valla fronteriza de ceuta desde marruecos v a,0
mantincelcatala  quico ro ya esa es la tendencia desde los a  os    contra m  s inmigraci  n vienen m  s castellano se habla y somos la comunidad con m  s inmigraci  n de toda espa  a duplicamos cualquier comunidad de espa  a en inmigrantes,0
pero la mujer es igual de puta que el porque lo sabia y no dijo nada ojala les pase lo mismo con su hija aver que les parece,1
realmente necesitamos una tensi  n a  adida a nuestro extenuante hogar  dos hijos peque  os  por las pu  eteras bolsas de pl  stico    la opini  n de  alb olmos http   t co,0
enununiversoparalelo soy lesbiana y rompo mas calzones que corazones,0
callate la bocaa  no tenes cara hijo de puta jajajaja,0
general mario rozas confirma    responsabilidad de carabineros    en denuncias de violaciones a los dd hh      http   t co  http   t co,0
soljc   p todo lo trans es bonito  creo  mi hermana dice que yo soy su trans sister y que ella es mi cis ter,0
monasterior  julia otero mira soplapijas  tu  eres la   ltima mierda que cag   la hiena para andar dando el serm  n a los dem  s  adem  s de estafadora y sinverg  enza  eres facha y retr  grada  eres in  til para la sociedad y muy repugnante  eres muy ve,1
uno ya no sabe que da m  s risa  s   cuando todas se cre  an la bigotuda frida o ahora que todas se creen o la versi  n fea de harley queen o la versi  n m  s pendeja de greta thunberg,1
yo entrando a la cocina a hacer la decimo octava cena http   t co,0
por unos reyes sin machismo http   t co,0
visita la tienda  gravitymty                calle matamoros      en el barrio antiguo  monterrey                 guadalajara  jalisco  cdmx  mexico  saltillo  cancun  regio  gay  jockstraps  suspensorios  underwear  swimwear  gym  ropainterior  gaymty  gaygdl  gaymx  hunk  jal  jalisco  gdl url,0
nataparrag  veraconce  juanasanhuezar   pedrolarach  patricionavia que argumentos tan s  lidos  ni sabes por qu   luchas feminazi,1
hoy hay concentraci n de monguers,1
a ver  personas veganas que comparan la industria c rnica con el holocausto  personas poc dicen que eso es racista,0
bolsonaro llama  mocosa  a greta thunberg tras condenar asesinato de ind  genas contin  a leyendo     http   t co   tlaxcala   a  os http   t co,0
carandino sabri c  llate puta de mierda ahi,1
los de la under le pasaron todo su pene por la cara a sudaca en traer al gran papacho,1
arturomendz si dios es todo   entonces tambi  n es gay,0
co o bloqueame ya no subnormal,1
feider    gretathunberg jajaja m  s mierda eres tu por hocicon jaja ya te metiste a su time line  jajaj idiota,0
la lectura es que tras un      encarcelar a gente y un presidente en b lgica  a n hay casi un     independentista,0
lafallaras  populares  ciudadanoscs estas absolutamente loca,1
javikaburaya soy demasiado subnormal para este mundo xd  yo digo que es seme  ya que karna me agrada demasiado como uke      t co ekkoyuetpn,0
es como seguir diciendo    feminazi     son palabras que no se deben replicar  ni de un lado ni del otro,0
cuenta la verdad  catalina creel era transexual  correvideo url,0
le tengo que explicar lo de que si quieres bolsa y cosas as   porque me han prohibido que vaya a fregar el suelo con la cara del puto cr  o que como lo enganche va a llorar con raz  n,0
greta thunberg y la causa de todo lo que va mal en el mundo http   t co,0
anabelalonso of a los subnormales le ha venido de puta madre el tema del coranavirus y cerrar las empresas y sin coles es estar de vacaciones y c  mo hace buen d  a vamos a la pedriza a pasar el http   t co  pregunto si la gente se pasa el virus  por   l,0
